{
  "$schema": "http://json-schema.org/draft-07/schema#",
  "$ref": "#/definitions/Model",
  "definitions": {
    "Model": {
      "type": "object",
      "properties": {
        "name": {
          "type": "string"
        },
        "label": {
          "type": "string"
        },
        "script": {
          "type": "string"
        },
        "description": {
          "type": "string"
        },
        "situation": {
          "type": "string",
          "enum": [
            "EDIT",
            "SEARCH",
            "CREATE"
          ]
        },
        "elements": {
          "type": "array",
          "minItems": 2,
          "items": [
            {
              "$ref": "#/definitions/CoreSection"
            },
            {
              "$ref": "#/definitions/DataSection"
            }
          ],
          "maxItems": 2
        }
      },
      "required": [
        "name",
        "situation",
        "elements"
      ],
      "additionalProperties": false
    },
    "CoreSection": {
      "type": "object",
      "properties": {
        "name": {
          "type": "string",
          "const": "core"
        },
        "label": {
          "type": "string"
        },
        "type": {
          "type": "string",
          "const": "o2mGroup"
        },
        "elements": {
          "type": "array",
          "items": {
            "anyOf": [
              {
                "$ref": "#/definitions/Group"
              },
              {
                "$ref": "#/definitions/Stack"
              },
              {
                "$ref": "#/definitions/FormElementBoolean"
              },
              {
                "$ref": "#/definitions/FormElementDatetime"
              },
              {
                "$ref": "#/definitions/FormElementDecimal"
              },
              {
                "$ref": "#/definitions/FormElementInteger"
              },
              {
                "$ref": "#/definitions/FormElementString"
              },
              {
                "$ref": "#/definitions/FormElementTable"
              }
            ]
          }
        },
        "layout": {
          "type": "object",
          "properties": {
            "align": {
              "type": "string",
              "enum": [
                "row",
                "column"
              ]
            }
          },
          "additionalProperties": false
        }
      },
      "required": [
        "elements",
        "name",
        "type"
      ],
      "additionalProperties": false
    },
    "Group": {
      "type": "object",
      "properties": {
        "name": {
          "type": "string"
        },
        "label": {
          "type": "string"
        },
        "type": {
          "type": "string",
          "const": "o2mGroup"
        },
        "elements": {
          "type": "array",
          "items": {
            "anyOf": [
              {
                "$ref": "#/definitions/Group"
              },
              {
                "$ref": "#/definitions/Stack"
              },
              {
                "$ref": "#/definitions/FormElementBoolean"
              },
              {
                "$ref": "#/definitions/FormElementDatetime"
              },
              {
                "$ref": "#/definitions/FormElementDecimal"
              },
              {
                "$ref": "#/definitions/FormElementInteger"
              },
              {
                "$ref": "#/definitions/FormElementString"
              },
              {
                "$ref": "#/definitions/FormElementTable"
              }
            ]
          }
        },
        "layout": {
          "type": "object",
          "properties": {
            "align": {
              "type": "string",
              "enum": [
                "row",
                "column"
              ]
            }
          },
          "additionalProperties": false
        }
      },
      "required": [
        "type",
        "elements"
      ],
      "additionalProperties": false
    },
    "Stack": {
      "type": "object",
      "properties": {
        "name": {
          "type": "string"
        },
        "type": {
          "type": "string",
          "const": "o2mGroupStack"
        },
        "elements": {
          "type": "array",
          "items": {
            "$ref": "#/definitions/Group"
          }
        }
      },
      "required": [
        "name",
        "type",
        "elements"
      ],
      "additionalProperties": false
    },
    "FormElementBoolean": {
      "type": "object",
      "properties": {
        "name": {
          "type": "string"
        },
        "label": {
          "type": "string"
        },
        "description": {
          "type": "string"
        },
        "type": {
          "type": "string",
          "const": "boolean"
        },
        "cardinality": {
          "type": "string",
          "enum": [
            "single",
            "multi"
          ]
        },
        "classifications": {
          "type": "array",
          "items": {
            "type": "string"
          }
        },
        "required": {
          "type": "boolean"
        },
        "readonly": {
          "type": "boolean"
        },
        "defaultvalue": {
          "type": "boolean"
        },
        "tristate": {
          "type": "boolean"
        }
      },
      "required": [
        "cardinality",
        "name",
        "type"
      ],
      "additionalProperties": false
    },
    "FormElementDatetime": {
      "type": "object",
      "properties": {
        "name": {
          "type": "string"
        },
        "label": {
          "type": "string"
        },
        "description": {
          "type": "string"
        },
        "type": {
          "type": "string",
          "const": "datetime"
        },
        "cardinality": {
          "type": "string",
          "enum": [
            "single",
            "multi"
          ]
        },
        "classifications": {
          "type": "array",
          "items": {
            "type": "string"
          }
        },
        "required": {
          "type": "boolean"
        },
        "readonly": {
          "type": "boolean"
        },
        "defaultvalue": {
          "anyOf": [
            {
              "type": "array",
              "items": {
                "type": "string"
              }
            },
            {
              "type": "string"
            }
          ]
        },
        "resolution": {
          "type": "string",
          "const": "date"
        }
      },
      "required": [
        "cardinality",
        "name",
        "type"
      ],
      "additionalProperties": false
    },
    "FormElementDecimal": {
      "type": "object",
      "properties": {
        "name": {
          "type": "string"
        },
        "label": {
          "type": "string"
        },
        "description": {
          "type": "string"
        },
        "type": {
          "type": "string",
          "const": "decimal"
        },
        "cardinality": {
          "type": "string",
          "enum": [
            "single",
            "multi"
          ]
        },
        "classifications": {
          "type": "array",
          "items": {
            "type": "string"
          }
        },
        "required": {
          "type": "boolean"
        },
        "readonly": {
          "type": "boolean"
        },
        "defaultvalue": {
          "anyOf": [
            {
              "type": "array",
              "items": {
                "type": "number"
              }
            },
            {
              "type": "number"
            }
          ]
        },
        "maxValue": {
          "type": "number"
        },
        "minValue": {
          "type": "number"
        },
        "precision": {
          "type": "number"
        },
        "scale": {
          "type": "number"
        },
        "grouping": {
          "type": "boolean"
        },
        "pattern": {
          "type": "string"
        }
      },
      "required": [
        "cardinality",
        "name",
        "type"
      ],
      "additionalProperties": false
    },
    "FormElementInteger": {
      "type": "object",
      "properties": {
        "name": {
          "type": "string"
        },
        "label": {
          "type": "string"
        },
        "description": {
          "type": "string"
        },
        "type": {
          "type": "string",
          "const": "integer"
        },
        "cardinality": {
          "type": "string",
          "enum": [
            "single",
            "multi"
          ]
        },
        "classifications": {
          "type": "array",
          "items": {
            "type": "string"
          }
        },
        "required": {
          "type": "boolean"
        },
        "readonly": {
          "type": "boolean"
        },
        "defaultvalue": {
          "anyOf": [
            {
              "type": "array",
              "items": {
                "type": "number"
              }
            },
            {
              "type": "number"
            }
          ]
        },
        "maxValue": {
          "type": "number"
        },
        "minValue": {
          "type": "number"
        },
        "precision": {
          "type": "number"
        },
        "grouping": {
          "type": "boolean"
        },
        "pattern": {
          "type": "string"
        }
      },
      "required": [
        "cardinality",
        "name",
        "type"
      ],
      "additionalProperties": false
    },
    "FormElementString": {
      "type": "object",
      "properties": {
        "name": {
          "type": "string"
        },
        "label": {
          "type": "string"
        },
        "description": {
          "type": "string"
        },
        "type": {
          "type": "string",
          "const": "string"
        },
        "cardinality": {
          "type": "string",
          "enum": [
            "single",
            "multi"
          ]
        },
        "classifications": {
          "type": "array",
          "items": {
            "type": "string"
          }
        },
        "required": {
          "type": "boolean"
        },
        "readonly": {
          "type": "boolean"
        },
        "defaultvalue": {
          "anyOf": [
            {
              "type": "array",
              "items": {
                "type": "string"
              }
            },
            {
              "type": "string"
            }
          ]
        },
        "maxLength": {
          "type": "number"
        },
        "minLength": {
          "type": "number"
        },
        "rows": {
          "type": "number"
        },
        "options": {
          "anyOf": [
            {
              "type": "array",
              "items": {
                "type": "string"
              }
            },
            {
              "type": "string"
            }
          ]
        },
        "regex": {
          "type": "string"
        }
      },
      "required": [
        "cardinality",
        "name",
        "type"
      ],
      "additionalProperties": false
    },
    "FormElementTable": {
      "type": "object",
      "properties": {
        "name": {
          "type": "string"
        },
        "label": {
          "type": "string"
        },
        "description": {
          "type": "string"
        },
        "type": {
          "type": "string",
          "const": "table"
        },
        "cardinality": {
          "type": "string",
          "enum": [
            "single",
            "multi"
          ]
        },
        "classifications": {
          "type": "array",
          "items": {
            "type": "string"
          }
        },
        "required": {
          "type": "boolean"
        },
        "readonly": {
          "type": "boolean"
        }
      },
      "required": [
        "cardinality",
        "name",
        "type"
      ],
      "additionalProperties": false
    },
    "DataSection": {
      "type": "object",
      "properties": {
        "name": {
          "type": "string",
          "const": "data"
        },
        "type": {
          "type": "string",
          "const": "o2mGroupStack"
        },
        "elements": {
          "type": "array",
          "items": {
            "$ref": "#/definitions/Group"
          }
        }
      },
      "required": [
        "elements",
        "name",
        "type"
      ],
      "additionalProperties": false
    }
  }
}